{
  "schemaVersion": "v1",
  "target": {
    "id": "target-repo",
    "repoPath": "/path/to/target-repo"
  },
  "contract": {
    "devBaseUrl": "SUPERLOOP_DEV_BASE_URL",
    "verifyBaseUrl": "SUPERLOOP_VERIFY_BASE_URL",
    "devPort": "SUPERLOOP_DEV_PORT"
  },
  "mappings": {
    "mode": "canonical_with_aliases",
    "fallbackAliases": [
      {
        "canonical": "SUPERLOOP_DEV_BASE_URL",
        "alias": "TARGET_BASE_URL"
      },
      {
        "canonical": "SUPERLOOP_VERIFY_BASE_URL",
        "alias": "TARGET_VERIFY_BASE_URL"
      },
      {
        "canonical": "SUPERLOOP_DEV_PORT",
        "alias": "TARGET_DEV_PORT"
      }
    ]
  },
  "evidence": {
    "requiredArtifacts": [
      "script_resolution_proof",
      "runbook_alignment_proof",
      "guardrail_check_proof"
    ]
  }
}
